 COMO IMPLANTAR LA CULTURA PREVENTIVA EN LA EMPRESA;ALEJANDRO MENDOZA PLAZA;2004;363.11;M 539;14285
CODIFICACION EN SALUD OCUPACIONAL;FERNANDO HENAO ROBLEDO;2008;363.11;H 493c;14208
ELABORACION DE UN PLAN DE EMERGENCIA EN LA EMPRESA;LUIS Mª AZCUENAGA LINAZA;2009;368.062;AZ 992;14279
ERGONOMIA;JAVIER BASCUAS HERNANDEZ;2001;373;B 214e;10886
ERGONOMIA Y CONDICIONES DE TRABAJO;ALAIN WISNER;1988;373;W 815e;10885
GESTION AMBIENTAL Y PLANIFICACION DE DESARROLLO. EL SUJETO AMBIENTAL Y LOS CONFLICTOS ECOLOGICOS DISCTRIBUTIVOS;ALONSO AVELLANEDA CUSARIA;2007;333.7;AV 949g;14227
GESTION DE LA HIGIENE INDUSTRIAL EN LA EMPRESA;PEDRO MATEO FLORIA;2002;363.729.5;M 425gsi;10850
GESTION DE LA HIGIENE INDUSTRIAL EN LA EMPRESA;PEDRO MATEO FLORIA;2009;363.729.5;M 425g;14317
GUIA PARA LA IMPLANTACION DE UN SISTEMA DE PREVENCION DE RIESGOS LABORALES;LUIS Mª AZCUENAGA LINAZA;2010;363.11;AZ 992g;14287
GUIA TECNICA RADIACION ULTRAVIOLETA- DE ORIGEN SOLAR;MINISTERIO SALUD -CHILE;2011;363;VARIOS;16693
LA PREVENCION DE RIESGOS EN LA LEY DE ACCIDENTES DEL TRABAJO Y ENFERMEDADES PROFESIONALES Nº 16.744;PEDRO MIGUEL CONTADOR ABRAHAM;1993;348.63;C 759p;2818
LABORATORIO DE ERGONOMIA;MERCEDES CHINER DASI;2001;373;C 539l;10965
MANUAL DE ERGONOMIA;FRANCISCO FARRER VELAZQUEZ;1995;373;F 434m;9936
MANUAL DE INSTALACIONES CONTRA INCENDIOS. EL FUEGO. AGENTES EXTINTORES. CALCULO HIDRAULICO;JUAN M. SUAY BELENGUER;2010;363.377;SV 939i;14245
MANUAL DE PREVENCION DE RIESGOS LABORALES Y GESTION AMBIENTAL EN CENTROS VETERINARIOS;IGNACIO RUIZ RODRIGUEZ;2003;368.07;R 934mp;14288
MANUAL DE PROTECCION CONTRA INCENDIOS;ARTHUR E. COTE;2001;363.377;C 843i;9899
MANUAL DE SEGURIDAD E HIGIENE INDUSTRIAL;CAMILO JANANIA ABRAHAN;1989;614.852;J 33;1869
MANUAL PARA EL TECNICO EN PREVENCION DE RIESGOS LABORALES;AGUSTIN GONZALEZ RUIZ;2011;363.11;E 643mt;14281
MANUAL PARA LA FORMACION DE NIVEL SUPERIOR EN PREVENCION DE RIESGOS LABORALES;JUAN CARLOS RUBIO ROMERO;2005;348;R 396;14241
MANUAL PARA LA GESTION DE LOS RESIDUOS URBANOS;CALOS ALONSO ALONSO;2003;333.7;AL 454;14255
MANUAL PARA LA GESTION DE LOS RESIDUOS URBANOS;CALOS ALONSO ALONSO;2003;333.7;AL 454;14272
PREVENCION DE RIESGOS LABORALES;ANGEL JAVIER VICENTE PEREZ;2005;368.062;P 438p;14273
PREVENCION DE RIESGOS LABORALES PARA APAREJADORES, ARQUITECTOS E INGENIEROS;EMILIO CARRASCO;2006;368.062;C 313p;14274
PREVENCION DE RIESGOS LABORALES. V.1. EVALUACION DE PREVENCION DE RIESGOS;V. VIANO;2000;348;V 614c;9265
PREVENCION DE RIESGOS LABORALES. V.3. TECNICAS AFINES A LA PREVENCION;V. VIANO;2000;348;V 614c;9265
PREVENCION DE RIESGOS LABORALES. V.4. CUESTIONES DE EVALUACION DE RIESGOS. FICHAS DE RIESGOS Y MEDIDAS DE PROTECCION;V. VIANO;2000;348;V 614c;9266
PREVENCION DE RIESGOS OCUPACIONALES Y PROTECCION MEDIO AMBIENTE;HUGO MURUA CH.;1969;350.783;M 984;16535
PREVENCION DE RIESGOS. SU APLICACIÓN EN EL CAMPO LABORAL;ROBERTO LAFONTAINE INFANTE;1983;350.783;C 339;16536
PRINCIPIOS PROTECCION CONTRA INCENDIOS;ARTHUR E. COTE;1993;363.377;C 843i;10187
REGLAMENTO DE SEGURIDAD CONTRA INCENDIOS EN LOS ESTABLECIMIENTOS INDUSTRIALES;MARIA JOSE LOPEZ RASO;2007;363.377;L 864r;14276
RIESGOS QUIMICOS;FERNANDO HENAO ROBLEDO;2009;368.14;H 493r;14286
SALUD LABORAL. CONCEPTOS Y TECNICAS PARA LA PREVENCION DE RIESGOS LABORALES;FERNANDO G. BENAVIDES;2000;362.100;B 456s;5669
SALUD LABORAL. CONCEPTOS Y TECNICAS PARA LA PREVENCION DE RIESGOS LABORALES;FERNANDO G. BENAVIDES;2000;362.100;B 456s;5833
SALUD LABORAL. CONCEPTOS Y TECNICAS PARA LA PREVENCION DE RIESGOS LABORALES;FERNANDO G. BENAVIDES;2000;362.100;B 456s;10351
SALUD LABORAL. CONCEPTOS Y TECNICAS PARA LA PREVENCION DE RIESGOS LABORALES;FERNANDO G. BENAVIDES;2000;362.100;B 456s;10352
SALUD LABORAL. CONCEPTOS Y TECNICAS PARA LA PREVENCION DE RIESGOS LABORALES;FERNANDO G. BENAVIDES;2000;362.100;B 456s;10354
SEGURIDAD E HIGIENE EN EL TRABAJO. TECNICAS DE PREVENCION DE RIESGOS LABORALES;JOSE MARIA CORTES DIAZ;2007;363.11;C 828t;13656
SEGURIDAD E HIGIENE EN EL TRABAJO. TECNICAS DE PREVENCION DE RIESGOS LABORALES;JOSE MARIA CORTES DIAZ;2007;363.11;C 828t;13657
SEGURIDAD INDUSTRIAL. CHARLAS Y EXPERIENCIAS PARA UN AMBIENTE SEGURO;ANDRES GIRALDO G.;2008;363.11;G 516s;14206
SISTEMA DE PREVENCION DE RIESGOS LABORALES;MARIA TERESA IGARTUA MIRO;2008;368.062;IG 24p;14275
TECNICAS DE PREVENCION DE RIESGOS LABORALES. SEGURIDAD E HIGIENE DEL TRABAJO;JOSE MARIA CORTES DIAZ;2007;363.11;C 828t;14280
VIGILANCIA DE LA SALUD DE LOS TRABAJADORES. ASPECTOS CLINICOS U JURIDICOS DE LOS RECONOCIMIENTOS MEDICOS EN EL TRABAJO;ANA GARCIA SERRANO;1999;362.100;G 216b;10771
